id,title,channel,categories,text_length,attachments_count,images_count,url,markdown_path
1014,关于举办智慧教育示范区市直属学校数字教师培训活动（第1期）的通知,公告通知,公告通知,71,1,1,https://szdjg.suzhou.edu.cn/NewsDetail.aspx?ID=1014,suzhou_djg_site_crawl_2026-05-15\articles\1014_关于举办智慧教育示范区市直属学校数字教师培训活动（第1期）的通知.md
1015,关于报送2020年中小学校长、骨干教师网络学习空间人人通专项培训苏州市参训学员名单的通知,公告通知,公告通知,95,1,1,https://szdjg.suzhou.edu.cn/NewsDetail.aspx?ID=1015,suzhou_djg_site_crawl_2026-05-15\articles\1015_关于报送2020年中小学校长、骨干教师网络学习空间人人通专项培训苏州市参训学员名单的通知.md
1016,关于举办“2020年苏州市中小学电脑制作活动机器人、创客竞赛及首届人工智能竞赛活动”培训的通知,公告通知,公告通知,101,1,1,https://szdjg.suzhou.edu.cn/NewsDetail.aspx?ID=1016,suzhou_djg_site_crawl_2026-05-15\articles\1016_关于举办“2020年苏州市中小学电脑制作活动机器人、创客竞赛及首届人工智能竞赛活动”培训的通知.md
1017,关于开展2020年苏州市青少年网络信息安全应用能力竞赛直属学校选拔赛的通知,公告通知,公告通知,81,1,1,https://szdjg.suzhou.edu.cn/NewsDetail.aspx?ID=1017,suzhou_djg_site_crawl_2026-05-15\articles\1017_关于开展2020年苏州市青少年网络信息安全应用能力竞赛直属学校选拔赛的通知.md
1018,关于开展2020年苏州市中小学电脑制作活动机器人、创客比赛暨首届人工智能大赛直属学校选拔赛的通知,公告通知,公告通知,103,1,1,https://szdjg.suzhou.edu.cn/NewsDetail.aspx?ID=1018,suzhou_djg_site_crawl_2026-05-15\articles\1018_关于开展2020年苏州市中小学电脑制作活动机器人、创客比赛暨首届人工智能大赛直属学校选拔赛的通知.md
1019,关于“2020年苏州市教育局信息资源服务管理平台绩效评价咨询服务”项目询价公告,公告通知,公告通知,85,1,1,https://szdjg.suzhou.edu.cn/NewsDetail.aspx?ID=1019,suzhou_djg_site_crawl_2026-05-15\articles\1019_关于“2020年苏州市教育局信息资源服务管理平台绩效评价咨询服务”项目询价公告.md
1020,关于“2020年教育局部门信息化专项-智慧化建设绩效评价咨询服务”项目询价公告,公告通知,公告通知,85,1,1,https://szdjg.suzhou.edu.cn/NewsDetail.aspx?ID=1020,suzhou_djg_site_crawl_2026-05-15\articles\1020_关于“2020年教育局部门信息化专项-智慧化建设绩效评价咨询服务”项目询价公告.md
1021,关于“2020年教育局部门信息化专项-信息化系统建设绩效评价咨询服务”项目询价公告,公告通知,公告通知,89,1,1,https://szdjg.suzhou.edu.cn/NewsDetail.aspx?ID=1021,suzhou_djg_site_crawl_2026-05-15\articles\1021_关于“2020年教育局部门信息化专项-信息化系统建设绩效评价咨询服务”项目询价公告.md
1022,关于举办2020年苏州市中小学电脑制作活动暨首届人工智能大赛现场赛的通知,公告通知,公告通知,79,1,1,https://szdjg.suzhou.edu.cn/NewsDetail.aspx?ID=1022,suzhou_djg_site_crawl_2026-05-15\articles\1022_关于举办2020年苏州市中小学电脑制作活动暨首届人工智能大赛现场赛的通知.md
1023,关于公布入围2020年苏州市中小学电脑制作活动机器人、创客比赛暨首届人工智能大赛直属学校选手名单的通知,公告通知,公告通知,109,1,1,https://szdjg.suzhou.edu.cn/NewsDetail.aspx?ID=1023,suzhou_djg_site_crawl_2026-05-15\articles\1023_关于公布入围2020年苏州市中小学电脑制作活动机器人、创客比赛暨首届人工智能大赛直属学校选手名单的通知.md
1024,关于组织开展2020年苏州市第五届青少年网络信息安全应用能力竞赛的通知,公告通知,公告通知,77,1,1,https://szdjg.suzhou.edu.cn/NewsDetail.aspx?ID=1024,suzhou_djg_site_crawl_2026-05-15\articles\1024_关于组织开展2020年苏州市第五届青少年网络信息安全应用能力竞赛的通知.md
1025,关于举办2020年苏州智慧教育示范区市直属学校创客式教学培训的通知,公告通知,公告通知,73,1,1,https://szdjg.suzhou.edu.cn/NewsDetail.aspx?ID=1025,suzhou_djg_site_crawl_2026-05-15\articles\1025_关于举办2020年苏州智慧教育示范区市直属学校创客式教学培训的通知.md
1026,关于公布入围2020年苏州市青少年网络信息安全应用能力竞赛直属学校选手名单的通知,公告通知,公告通知,87,1,1,https://szdjg.suzhou.edu.cn/NewsDetail.aspx?ID=1026,suzhou_djg_site_crawl_2026-05-15\articles\1026_关于公布入围2020年苏州市青少年网络信息安全应用能力竞赛直属学校选手名单的通知.md
1027,关于举办智慧教育示范区市直属学校数字教师培训活动(第2期)的通知,公告通知,公告通知,71,1,1,https://szdjg.suzhou.edu.cn/NewsDetail.aspx?ID=1027,suzhou_djg_site_crawl_2026-05-15\articles\1027_关于举办智慧教育示范区市直属学校数字教师培训活动(第2期)的通知.md
1030,关于举行2020年苏州市信息化教学能手比赛的通知,公告通知,公告通知,55,1,1,https://szdjg.suzhou.edu.cn/NewsDetail.aspx?ID=1030,suzhou_djg_site_crawl_2026-05-15\articles\1030_关于举行2020年苏州市信息化教学能手比赛的通知.md
1031,关于举行2020年苏州市信息化教学能手大赛直属学校选拔赛的通知,公告通知,公告通知,69,1,1,https://szdjg.suzhou.edu.cn/NewsDetail.aspx?ID=1031,suzhou_djg_site_crawl_2026-05-15\articles\1031_关于举行2020年苏州市信息化教学能手大赛直属学校选拔赛的通知.md
1032,关于组织参加2020年”领航杯“江苏省中小学电脑制作活动暨首届人工智能大赛的通知,公告通知,公告通知,87,1,1,https://szdjg.suzhou.edu.cn/NewsDetail.aspx?ID=1032,suzhou_djg_site_crawl_2026-05-15\articles\1032_关于组织参加2020年”领航杯“江苏省中小学电脑制作活动暨首届人工智能大赛的通知.md
1033,关于举办苏州市智慧教育示范区市直属学校新技术新媒体应用培训的通知,公告通知,公告通知,71,1,1,https://szdjg.suzhou.edu.cn/NewsDetail.aspx?ID=1033,suzhou_djg_site_crawl_2026-05-15\articles\1033_关于举办苏州市智慧教育示范区市直属学校新技术新媒体应用培训的通知.md
1034,关于公布入围2020年苏州市信息化教学能手大赛直属学校选手名单的通知,公告通知,公告通知,77,1,1,https://szdjg.suzhou.edu.cn/NewsDetail.aspx?ID=1034,suzhou_djg_site_crawl_2026-05-15\articles\1034_关于公布入围2020年苏州市信息化教学能手大赛直属学校选手名单的通知.md
1035,关于公布2020年苏州市中学生英语口语电视比赛细则的通知,公告通知,公告通知,63,1,1,https://szdjg.suzhou.edu.cn/NewsDetail.aspx?ID=1035,suzhou_djg_site_crawl_2026-05-15\articles\1035_关于公布2020年苏州市中学生英语口语电视比赛细则的通知.md
1036,关于举办苏州市首批江苏省网络名师工作室现场交流活动的通知,公告通知,公告通知,63,1,1,https://szdjg.suzhou.edu.cn/NewsDetail.aspx?ID=1036,suzhou_djg_site_crawl_2026-05-15\articles\1036_关于举办苏州市首批江苏省网络名师工作室现场交流活动的通知.md
1037,关于组织参加2020年“领航杯”江苏省信息化教学能手大赛的通知,公告通知,公告通知,69,1,1,https://szdjg.suzhou.edu.cn/NewsDetail.aspx?ID=1037,suzhou_djg_site_crawl_2026-05-15\articles\1037_关于组织参加2020年“领航杯”江苏省信息化教学能手大赛的通知.md
1039,关于举行2020年苏州市信息技术与教育教学融合创新研讨活动的通知,公告通知,公告通知,71,1,1,https://szdjg.suzhou.edu.cn/NewsDetail.aspx?ID=1039,suzhou_djg_site_crawl_2026-05-15\articles\1039_关于举行2020年苏州市信息技术与教育教学融合创新研讨活动的通知.md
1040,关于公布苏州市推荐参加2020年“领航杯”江苏省第十九届中学生英语口语电视比赛选手名单暨组织参加比赛的通知,公告通知,公告通知,113,1,1,https://szdjg.suzhou.edu.cn/NewsDetail.aspx?ID=1040,suzhou_djg_site_crawl_2026-05-15\articles\1040_关于公布苏州市推荐参加2020年“领航杯”江苏省第十九届中学生英语口语电视比赛选手名单暨组织参加比赛的通知.md
1041,关于公布2020年苏州市教育信息化论文评选活动获奖名单的通知,公告通知,公告通知,67,1,1,https://szdjg.suzhou.edu.cn/NewsDetail.aspx?ID=1041,suzhou_djg_site_crawl_2026-05-15\articles\1041_关于公布2020年苏州市教育信息化论文评选活动获奖名单的通知.md
1042,关于公布2020年苏州市直属学校青少年网络信息安全应用能力竞赛获奖名单的通知,公告通知,公告通知,83,1,1,https://szdjg.suzhou.edu.cn/NewsDetail.aspx?ID=1042,suzhou_djg_site_crawl_2026-05-15\articles\1042_关于公布2020年苏州市直属学校青少年网络信息安全应用能力竞赛获奖名单的通知.md
1043,关于公布2020年苏州市直属学校信息化教学能手大赛获奖名单的通知,公告通知,公告通知,71,1,1,https://szdjg.suzhou.edu.cn/NewsDetail.aspx?ID=1043,suzhou_djg_site_crawl_2026-05-15\articles\1043_关于公布2020年苏州市直属学校信息化教学能手大赛获奖名单的通知.md
1044,关于组织开展“节约千万家 健康你我他”网上冬令营活动的通知,公告通知,公告通知,65,1,1,https://szdjg.suzhou.edu.cn/NewsDetail.aspx?ID=1044,suzhou_djg_site_crawl_2026-05-15\articles\1044_关于组织开展“节约千万家 健康你我他”网上冬令营活动的通知.md
1045,关于转发2021年新媒体新技术教学应用研讨会暨第十四届全国中小学创新课堂教学实践观摩活动指南的通知,公告通知,公告通知,105,1,1,https://szdjg.suzhou.edu.cn/NewsDetail.aspx?ID=1045,suzhou_djg_site_crawl_2026-05-15\articles\1045_关于转发2021年新媒体新技术教学应用研讨会暨第十四届全国中小学创新课堂教学实践观摩活动指南的通知.md
1046,关于召开2021年苏州市教育信息化研究暨应用能力大赛组织工作交流会的通知,公告通知,公告通知,79,1,1,https://szdjg.suzhou.edu.cn/NewsDetail.aspx?ID=1046,suzhou_djg_site_crawl_2026-05-15\articles\1046_关于召开2021年苏州市教育信息化研究暨应用能力大赛组织工作交流会的通知.md
1047,关于公布“中国梦—行动有我”校本德育课程和教育案例等征集活动结果的通知,公告通知,公告通知,77,1,1,https://szdjg.suzhou.edu.cn/NewsDetail.aspx?ID=1047,suzhou_djg_site_crawl_2026-05-15\articles\1047_关于公布“中国梦—行动有我”校本德育课程和教育案例等征集活动结果的通知.md
1048,关于公布苏州市“中国梦-行动有我：2020年苏州市中小幼学生‘成语中国’微电影征集展播活动”结果的通知,公告通知,公告通知,109,1,1,https://szdjg.suzhou.edu.cn/NewsDetail.aspx?ID=1048,suzhou_djg_site_crawl_2026-05-15\articles\1048_关于公布苏州市“中国梦-行动有我：2020年苏州市中小幼学生‘成语中国’微电影征集展播活动”结果的通知.md
1049,2021元旦春节期间“清风行动”专项督查 自查报告,公告通知,公告通知,56,1,1,https://szdjg.suzhou.edu.cn/NewsDetail.aspx?ID=1049,suzhou_djg_site_crawl_2026-05-15\articles\1049_2021元旦春节期间“清风行动”专项督查 自查报告.md
1050,关于组织开展“再见2020，你好2021”微视频征集活动的通知,公告通知,公告通知,69,1,1,https://szdjg.suzhou.edu.cn/NewsDetail.aspx?ID=1050,suzhou_djg_site_crawl_2026-05-15\articles\1050_关于组织开展“再见2020，你好2021”微视频征集活动的通知.md
1051,关于举办苏州市第二批江苏省中小学网络名师工作室培训活动的通知,公告通知,公告通知,67,1,1,https://szdjg.suzhou.edu.cn/NewsDetail.aspx?ID=1051,suzhou_djg_site_crawl_2026-05-15\articles\1051_关于举办苏州市第二批江苏省中小学网络名师工作室培训活动的通知.md
1052,关于召开2021年度全市教育信息化机构馆长（主任）会议的通知,公告通知,公告通知,66,1,1,https://szdjg.suzhou.edu.cn/NewsDetail.aspx?ID=1052,suzhou_djg_site_crawl_2026-05-15\articles\1052_关于召开2021年度全市教育信息化机构馆长（主任）会议的通知.md
1053,关于“2021年PC网站、微信公众号、OA系统、党建网站项目年度维护服务”项目询价公告,公告通知,公告通知,93,1,1,https://szdjg.suzhou.edu.cn/NewsDetail.aspx?ID=1053,suzhou_djg_site_crawl_2026-05-15\articles\1053_关于“2021年PC网站、微信公众号、OA系统、党建网站项目年度维护服务”项目询价公告.md
1054,苏州市电化教育馆项目资金财政支付管理办法,公告通知,公告通知,47,1,1,https://szdjg.suzhou.edu.cn/NewsDetail.aspx?ID=1054,suzhou_djg_site_crawl_2026-05-15\articles\1054_苏州市电化教育馆项目资金财政支付管理办法.md
1055,关于举办2021年苏州市中小学生信息素养提升实践活动的通知,公告通知,公告通知,64,1,1,https://szdjg.suzhou.edu.cn/NewsDetail.aspx?ID=1055,suzhou_djg_site_crawl_2026-05-15\articles\1055_关于举办2021年苏州市中小学生信息素养提升实践活动的通知.md
1056,关于召开2021年苏州市中小学生信息素养提升实践活动组织工作研讨会的通知,公告通知,公告通知,78,1,1,https://szdjg.suzhou.edu.cn/NewsDetail.aspx?ID=1056,suzhou_djg_site_crawl_2026-05-15\articles\1056_关于召开2021年苏州市中小学生信息素养提升实践活动组织工作研讨会的通知.md
1057,关于开展2021年苏州市中小学生信息素养提升实践活动创客比赛、人工智能大赛直属学校选拔赛的通知,公告通知,公告通知,100,1,1,https://szdjg.suzhou.edu.cn/NewsDetail.aspx?ID=1057,suzhou_djg_site_crawl_2026-05-15\articles\1057_关于开展2021年苏州市中小学生信息素养提升实践活动创客比赛、人工智能大赛直属学校选拔赛的通知.md
1058,关于《苏州教育信息化》之“慧学”分册征稿通知,公告通知,公告通知,51,1,1,https://szdjg.suzhou.edu.cn/NewsDetail.aspx?ID=1058,suzhou_djg_site_crawl_2026-05-15\articles\1058_关于《苏州教育信息化》之“慧学”分册征稿通知.md
1060,关于推荐2021年苏州市中小学生信息素养提升实践活动裁判员的通知,公告通知,公告通知,70,1,1,https://szdjg.suzhou.edu.cn/NewsDetail.aspx?ID=1060,suzhou_djg_site_crawl_2026-05-15\articles\1060_关于推荐2021年苏州市中小学生信息素养提升实践活动裁判员的通知.md
1061,苏州市教育信息化心理辅导学会收取会费的通知,公告通知,公告通知,49,1,1,https://szdjg.suzhou.edu.cn/NewsDetail.aspx?ID=1061,suzhou_djg_site_crawl_2026-05-15\articles\1061_苏州市教育信息化心理辅导学会收取会费的通知.md
1062,关于苏州教育城域网传输链路维护及传输设备日常巡检维护服务项目的采购公告,公告通知,公告通知,1698,1,1,https://szdjg.suzhou.edu.cn/NewsDetail.aspx?ID=1062,suzhou_djg_site_crawl_2026-05-15\articles\1062_关于苏州教育城域网传输链路维护及传输设备日常巡检维护服务项目的采购公告.md
1063,2021年度对各市区教育信息化机构考评细则,公告通知,公告通知,49,1,1,https://szdjg.suzhou.edu.cn/NewsDetail.aspx?ID=1063,suzhou_djg_site_crawl_2026-05-15\articles\1063_2021年度对各市区教育信息化机构考评细则.md
1064,关于举办2021年苏州市中小学生信息素养提升实践活动现场赛的通知,公告通知,公告通知,70,1,1,https://szdjg.suzhou.edu.cn/NewsDetail.aspx?ID=1064,suzhou_djg_site_crawl_2026-05-15\articles\1064_关于举办2021年苏州市中小学生信息素养提升实践活动现场赛的通知.md
1065,教育城域网传输链路维护及传输设备日常巡检维护服务的成交公告,公告通知,公告通知,632,0,1,https://szdjg.suzhou.edu.cn/NewsDetail.aspx?ID=1065,suzhou_djg_site_crawl_2026-05-15\articles\1065_教育城域网传输链路维护及传输设备日常巡检维护服务的成交公告.md
1066,关于开展苏州市教育局互联网基础资产普查专项行动的通知,公告通知,公告通知,59,1,1,https://szdjg.suzhou.edu.cn/NewsDetail.aspx?ID=1066,suzhou_djg_site_crawl_2026-05-15\articles\1066_关于开展苏州市教育局互联网基础资产普查专项行动的通知.md
1067,关于VPN设备采购项目的询价采购公告,公告通知,公告通知,1523,0,1,https://szdjg.suzhou.edu.cn/NewsDetail.aspx?ID=1067,suzhou_djg_site_crawl_2026-05-15\articles\1067_关于VPN设备采购项目的询价采购公告.md
1068,关于转发《中央电化教育馆“中国梦—行动有我：中小幼学生‘成语中国’微电影征集展播活动”手作视频动画交流研讨会》的通知,公告通知,公告通知,122,1,1,https://szdjg.suzhou.edu.cn/NewsDetail.aspx?ID=1068,suzhou_djg_site_crawl_2026-05-15\articles\1068_关于转发《中央电化教育馆“中国梦—行动有我：中小幼学生‘成语中国’微电影征集展播活动”手作视频动画交流研讨会》的通知.md
1069,关于原服务器硬件增加项目的采购公告,公告通知,公告通知,1478,0,1,https://szdjg.suzhou.edu.cn/NewsDetail.aspx?ID=1069,suzhou_djg_site_crawl_2026-05-15\articles\1069_关于原服务器硬件增加项目的采购公告.md
1070,关于举办2021年苏州智慧教育示范区中小学教师信息技术应用能力提升培训（春季班）的通知,公告通知,公告通知,93,1,1,https://szdjg.suzhou.edu.cn/NewsDetail.aspx?ID=1070,suzhou_djg_site_crawl_2026-05-15\articles\1070_关于举办2021年苏州智慧教育示范区中小学教师信息技术应用能力提升培训（春季班）的通知.md
1071,关于转发《中央电化教育馆“中国梦—行动有我：中小幼学生‘成语中国’微电影征集展播活动”手作视频动画交流研讨会》的通知,公告通知,公告通知,123,1,1,https://szdjg.suzhou.edu.cn/NewsDetail.aspx?ID=1071,suzhou_djg_site_crawl_2026-05-15\articles\1071_关于转发《中央电化教育馆“中国梦—行动有我：中小幼学生‘成语中国’微电影征集展播活动”手作视频动画交流研讨会》的通知.md
1072,关于举办2021年苏州智慧教育示范区中小学教师信息技术应用能力提升培训（春季班）的通知,公告通知,公告通知,93,1,1,https://szdjg.suzhou.edu.cn/NewsDetail.aspx?ID=1072,suzhou_djg_site_crawl_2026-05-15\articles\1072_关于举办2021年苏州智慧教育示范区中小学教师信息技术应用能力提升培训（春季班）的通知.md
1073,关于举行2021年苏州市幼儿园信息化教学展示研讨活动的通知,公告通知,公告通知,65,1,1,https://szdjg.suzhou.edu.cn/NewsDetail.aspx?ID=1073,suzhou_djg_site_crawl_2026-05-15\articles\1073_关于举行2021年苏州市幼儿园信息化教学展示研讨活动的通知.md
1074,关于举行2021年苏州市信息化教学能手比赛直属幼儿园选拔赛的通知,公告通知,公告通知,73,1,1,https://szdjg.suzhou.edu.cn/NewsDetail.aspx?ID=1074,suzhou_djg_site_crawl_2026-05-15\articles\1074_关于举行2021年苏州市信息化教学能手比赛直属幼儿园选拔赛的通知.md
1075,关于举办2021年苏州市多媒体教育软件比赛的通知,公告通知,公告通知,55,1,1,https://szdjg.suzhou.edu.cn/NewsDetail.aspx?ID=1075,suzhou_djg_site_crawl_2026-05-15\articles\1075_关于举办2021年苏州市多媒体教育软件比赛的通知.md
1076,关于开展2021年苏州市教师风采短视频征集活动的通知,公告通知,公告通知,59,1,1,https://szdjg.suzhou.edu.cn/NewsDetail.aspx?ID=1076,suzhou_djg_site_crawl_2026-05-15\articles\1076_关于开展2021年苏州市教师风采短视频征集活动的通知.md
1077,关于举办2021年度苏州市智慧教育示范区数字教师培训活动（第1期）的通知,公告通知,公告通知,79,1,1,https://szdjg.suzhou.edu.cn/NewsDetail.aspx?ID=1077,suzhou_djg_site_crawl_2026-05-15\articles\1077_关于举办2021年度苏州市智慧教育示范区数字教师培训活动（第1期）的通知.md
1079,关于组织参加2021年“领航杯”江苏省中小学生信息素养提升实践活动现场赛的通知,公告通知,公告通知,85,1,1,https://szdjg.suzhou.edu.cn/NewsDetail.aspx?ID=1079,suzhou_djg_site_crawl_2026-05-15\articles\1079_关于组织参加2021年“领航杯”江苏省中小学生信息素养提升实践活动现场赛的通知.md
1080,关于举办2021年苏州市幼儿园组信息化教学能手比赛的通知,公告通知,公告通知,64,1,1,https://szdjg.suzhou.edu.cn/NewsDetail.aspx?ID=1080,suzhou_djg_site_crawl_2026-05-15\articles\1080_关于举办2021年苏州市幼儿园组信息化教学能手比赛的通知.md
1081,关于举办2021年度苏州市智慧教育示范区数字教师培训活动（第2期）的通知,公告通知,公告通知,79,1,1,https://szdjg.suzhou.edu.cn/NewsDetail.aspx?ID=1081,suzhou_djg_site_crawl_2026-05-15\articles\1081_关于举办2021年度苏州市智慧教育示范区数字教师培训活动（第2期）的通知.md
1082,关于组织市区高考考点学校广播员培训的通知,公告通知,公告通知,47,1,1,https://szdjg.suzhou.edu.cn/NewsDetail.aspx?ID=1082,suzhou_djg_site_crawl_2026-05-15\articles\1082_关于组织市区高考考点学校广播员培训的通知.md
1083,关于暑期改造及维修采购的磋商公告,公告通知,公告通知,1598,0,1,https://szdjg.suzhou.edu.cn/NewsDetail.aspx?ID=1083,suzhou_djg_site_crawl_2026-05-15\articles\1083_关于暑期改造及维修采购的磋商公告.md
1084,关于采购杀毒软件竞争性谈判采购的公告,公告通知,公告通知,1140,0,1,https://szdjg.suzhou.edu.cn/NewsDetail.aspx?ID=1084,suzhou_djg_site_crawl_2026-05-15\articles\1084_关于采购杀毒软件竞争性谈判采购的公告.md
1085,关于组织开展2021年苏州市“中国梦—行动有我”系列活动的通知,公告通知,公告通知,69,1,1,https://szdjg.suzhou.edu.cn/NewsDetail.aspx?ID=1085,suzhou_djg_site_crawl_2026-05-15\articles\1085_关于组织开展2021年苏州市“中国梦—行动有我”系列活动的通知.md
1086,关于开展2021年苏州市第六届青少年网络信息安全应用能力竞赛直属学校选拔赛的通知,公告通知,公告通知,87,1,1,https://szdjg.suzhou.edu.cn/NewsDetail.aspx?ID=1086,suzhou_djg_site_crawl_2026-05-15\articles\1086_关于开展2021年苏州市第六届青少年网络信息安全应用能力竞赛直属学校选拔赛的通知.md
1087,关于开展苏州市人工智能教育实验学校申报与评审工作的通知,公告通知,公告通知,61,1,1,https://szdjg.suzhou.edu.cn/NewsDetail.aspx?ID=1087,suzhou_djg_site_crawl_2026-05-15\articles\1087_关于开展苏州市人工智能教育实验学校申报与评审工作的通知.md
1088,2021年苏州市中小学生信息素养提升实践活动成绩揭晓,公告通知,公告通知,58,1,1,https://szdjg.suzhou.edu.cn/NewsDetail.aspx?ID=1088,suzhou_djg_site_crawl_2026-05-15\articles\1088_2021年苏州市中小学生信息素养提升实践活动成绩揭晓.md
1093,关于苏州市教育E卡通运营维护服务信息化监理的邀标公告,公告通知,公告通知,706,0,1,https://szdjg.suzhou.edu.cn/NewsDetail.aspx?ID=1093,suzhou_djg_site_crawl_2026-05-15\articles\1093_关于苏州市教育E卡通运营维护服务信息化监理的邀标公告.md
1096,关于苏州教育城域网互联网出口接入服务项目的单一来源采购公告（电信互联网出口）,公告通知,公告通知,514,0,1,https://szdjg.suzhou.edu.cn/NewsDetail.aspx?ID=1096,suzhou_djg_site_crawl_2026-05-15\articles\1096_关于苏州教育城域网互联网出口接入服务项目的单一来源采购公告（电信互联网出口）.md
1097,关于苏州教育城域网互联网出口接入服务项目的单一来源采购公告（联通互联网出口）,公告通知,公告通知,641,1,1,https://szdjg.suzhou.edu.cn/NewsDetail.aspx?ID=1097,suzhou_djg_site_crawl_2026-05-15\articles\1097_关于苏州教育城域网互联网出口接入服务项目的单一来源采购公告（联通互联网出口）.md
1098,苏州市电化教育馆关于媒体中心设备日常更新的采购公告,公告通知,公告通知,1199,0,1,https://szdjg.suzhou.edu.cn/NewsDetail.aspx?ID=1098,suzhou_djg_site_crawl_2026-05-15\articles\1098_苏州市电化教育馆关于媒体中心设备日常更新的采购公告.md
1099,苏州市电化教育馆关于苏州教育视频会议运维服务项目竞争性谈判采购公告,公告通知,公告通知,1556,0,1,https://szdjg.suzhou.edu.cn/NewsDetail.aspx?ID=1099,suzhou_djg_site_crawl_2026-05-15\articles\1099_苏州市电化教育馆关于苏州教育视频会议运维服务项目竞争性谈判采购公告.md
1100,采购项目暂停公告,公告通知,公告通知,385,0,1,https://szdjg.suzhou.edu.cn/NewsDetail.aspx?ID=1100,suzhou_djg_site_crawl_2026-05-15\articles\1100_采购项目暂停公告.md
1101,苏州市电化教育馆关于媒体中心设备更新维护的采购公告,公告通知,公告通知,1277,0,1,https://szdjg.suzhou.edu.cn/NewsDetail.aspx?ID=1101,suzhou_djg_site_crawl_2026-05-15\articles\1101_苏州市电化教育馆关于媒体中心设备更新维护的采购公告.md
1102,关于2022年江苏省系列教育信息化应用能力大赛市级选拔赛和专题研讨活动项目的采购公告,公告通知,公告通知,1683,0,1,https://szdjg.suzhou.edu.cn/NewsDetail.aspx?ID=1102,suzhou_djg_site_crawl_2026-05-15\articles\1102_关于2022年江苏省系列教育信息化应用能力大赛市级选拔赛和专题研讨活动项目的采购公告.md
