id,title,channel,categories,text_length,attachments_count,images_count,url,markdown_path
1196,关于苏州市电化教育馆媒体中心设备采购项目的成交公告,公告通知,公告通知,770,0,1,https://szdjg.suzhou.edu.cn/NewsDetail.aspx?ID=1196,suzhou_djg_site_crawl_2026-05-15\articles\1196_关于苏州市电化教育馆媒体中心设备采购项目的成交公告.md
1197,苏州市电化教育馆部门整体预算绩效目标表,公告通知,公告通知,45,1,1,https://szdjg.suzhou.edu.cn/NewsDetail.aspx?ID=1197,suzhou_djg_site_crawl_2026-05-15\articles\1197_苏州市电化教育馆部门整体预算绩效目标表.md
1198,苏州市电化教育馆2023年度单位预算公开,公告通知,公告通知,47,1,1,https://szdjg.suzhou.edu.cn/NewsDetail.aspx?ID=1198,suzhou_djg_site_crawl_2026-05-15\articles\1198_苏州市电化教育馆2023年度单位预算公开.md
1199,2023年苏州市电化教育馆项目预算绩效目标公开,公告通知,公告通知,53,1,1,https://szdjg.suzhou.edu.cn/NewsDetail.aspx?ID=1199,suzhou_djg_site_crawl_2026-05-15\articles\1199_2023年苏州市电化教育馆项目预算绩效目标公开.md
1200,关于2023年江苏省系列教育信息化应用能力大赛市级选拔赛和苏州市智慧校园发展水平星级评估与人工智能教育实验学校评审项目的成交公告,公告通知,公告通知,691,0,1,https://szdjg.suzhou.edu.cn/NewsDetail.aspx?ID=1200,suzhou_djg_site_crawl_2026-05-15\articles\1200_关于2023年江苏省系列教育信息化应用能力大赛市级选拔赛和苏州市智慧校园发展水平星级评估与人工智能教育实验学校评审项目的成交公告.md
1201,关于苏州教育私有云备份系统后端存储设备项目的竞争性谈判采购公告,公告通知,公告通知,1417,0,1,https://szdjg.suzhou.edu.cn/NewsDetail.aspx?ID=1201,suzhou_djg_site_crawl_2026-05-15\articles\1201_关于苏州教育私有云备份系统后端存储设备项目的竞争性谈判采购公告.md
1202,关于教育私有云备份系统后端存储设备项目的成交公告,公告通知,公告通知,582,0,1,https://szdjg.suzhou.edu.cn/NewsDetail.aspx?ID=1202,suzhou_djg_site_crawl_2026-05-15\articles\1202_关于教育私有云备份系统后端存储设备项目的成交公告.md
1203,关于“2023年PC网站、微信公众号、OA系统、党建网站项目年度内容维护服务”项目询价公告,公告通知,公告通知,559,0,1,https://szdjg.suzhou.edu.cn/NewsDetail.aspx?ID=1203,suzhou_djg_site_crawl_2026-05-15\articles\1203_关于“2023年PC网站、微信公众号、OA系统、党建网站项目年度内容维护服务”项目询价公告.md
1204,关于中心机房及城域网日常运维服务采购项目的采购公告,公告通知,公告通知,1349,0,1,https://szdjg.suzhou.edu.cn/NewsDetail.aspx?ID=1204,suzhou_djg_site_crawl_2026-05-15\articles\1204_关于中心机房及城域网日常运维服务采购项目的采购公告.md
1205,关于苏州电教馆中心机房及城域网日常运维服务项目的成交公告,公告通知,公告通知,580,0,1,https://szdjg.suzhou.edu.cn/NewsDetail.aspx?ID=1205,suzhou_djg_site_crawl_2026-05-15\articles\1205_关于苏州电教馆中心机房及城域网日常运维服务项目的成交公告.md
1206,关于恢复组织开展“体验智能魅力 牢记网络安全”活动的通知,公告通知,公告通知,63,1,1,https://szdjg.suzhou.edu.cn/NewsDetail.aspx?ID=1206,suzhou_djg_site_crawl_2026-05-15\articles\1206_关于恢复组织开展“体验智能魅力 牢记网络安全”活动的通知.md
1207,关于开展苏州市元宇宙重大应用场景需求征集工作的通知,公告通知,公告通知,57,1,1,https://szdjg.suzhou.edu.cn/NewsDetail.aspx?ID=1207,suzhou_djg_site_crawl_2026-05-15\articles\1207_关于开展苏州市元宇宙重大应用场景需求征集工作的通知.md
1208,关于召开2023年苏州市教育信息化应用研究暨应用能力大赛组织工作交流研讨会的通知,公告通知,公告通知,87,1,1,https://szdjg.suzhou.edu.cn/NewsDetail.aspx?ID=1208,suzhou_djg_site_crawl_2026-05-15\articles\1208_关于召开2023年苏州市教育信息化应用研究暨应用能力大赛组织工作交流研讨会的通知.md
1209,关于举办2023年苏州市中小学生信息素养提升实践活动的通知,公告通知,公告通知,65,1,1,https://szdjg.suzhou.edu.cn/NewsDetail.aspx?ID=1209,suzhou_djg_site_crawl_2026-05-15\articles\1209_关于举办2023年苏州市中小学生信息素养提升实践活动的通知.md
1210,关于公布2022年苏州市“中国梦—行动有我”系列活动结果的通知,公告通知,公告通知,69,1,1,https://szdjg.suzhou.edu.cn/NewsDetail.aspx?ID=1210,suzhou_djg_site_crawl_2026-05-15\articles\1210_关于公布2022年苏州市“中国梦—行动有我”系列活动结果的通知.md
1211,关于调整、重组部分职能部门及公布2023年度中层岗位聘任决定的通知,公告通知,公告通知,73,1,1,https://szdjg.suzhou.edu.cn/NewsDetail.aspx?ID=1211,suzhou_djg_site_crawl_2026-05-15\articles\1211_关于调整、重组部分职能部门及公布2023年度中层岗位聘任决定的通知.md
1212,关于举办2023年苏州市中小学生信息素养提升实践活动培训的通知,公告通知,公告通知,69,1,1,https://szdjg.suzhou.edu.cn/NewsDetail.aspx?ID=1212,suzhou_djg_site_crawl_2026-05-15\articles\1212_关于举办2023年苏州市中小学生信息素养提升实践活动培训的通知.md
1213,关于举办2023年苏州智慧教育示范区中小学教师信息技术应用能力提升在线培训（春季班）的通知,公告通知,公告通知,97,1,1,https://szdjg.suzhou.edu.cn/NewsDetail.aspx?ID=1213,suzhou_djg_site_crawl_2026-05-15\articles\1213_关于举办2023年苏州智慧教育示范区中小学教师信息技术应用能力提升在线培训（春季班）的通知.md
1214,关于转发江苏省电化教育馆《关于做好江苏省城乡结对互动课堂管理平台接入工作的通知》的通知,公告通知,公告通知,93,1,1,https://szdjg.suzhou.edu.cn/NewsDetail.aspx?ID=1214,suzhou_djg_site_crawl_2026-05-15\articles\1214_关于转发江苏省电化教育馆《关于做好江苏省城乡结对互动课堂管理平台接入工作的通知》的通知.md
1215,关于组织推荐苏州市中小学生信息素养提升实践活动专家库人选的通知,公告通知,公告通知,69,1,1,https://szdjg.suzhou.edu.cn/NewsDetail.aspx?ID=1215,suzhou_djg_site_crawl_2026-05-15\articles\1215_关于组织推荐苏州市中小学生信息素养提升实践活动专家库人选的通知.md
1216,2023年度对各县级市（区）教育信息化机构考评细则,公告通知,公告通知,57,1,1,https://szdjg.suzhou.edu.cn/NewsDetail.aspx?ID=1216,suzhou_djg_site_crawl_2026-05-15\articles\1216_2023年度对各县级市（区）教育信息化机构考评细则.md
1217,关于2023年苏州市中小学生信息素养提升实践活动具体工作实施的通知,公告通知,公告通知,73,1,1,https://szdjg.suzhou.edu.cn/NewsDetail.aspx?ID=1217,suzhou_djg_site_crawl_2026-05-15\articles\1217_关于2023年苏州市中小学生信息素养提升实践活动具体工作实施的通知.md
1218,关于转发教育部教育技术与资源发展中心（央馆）《关于召开“央馆人工智能课程”规模化应用第一期试点工作第一次交流会的通知》的通知,公告通知,公告通知,131,1,1,https://szdjg.suzhou.edu.cn/NewsDetail.aspx?ID=1218,suzhou_djg_site_crawl_2026-05-15\articles\1218_关于转发教育部教育技术与资源发展中心（央馆）《关于召开“央馆人工智能课程”规模化应用第一期试点工作第一次交流会的通知》的通知.md
1219,关于开展首批苏州市中小学师生信息素养提升实验基地申报与认定的通知,公告通知,公告通知,71,1,1,https://szdjg.suzhou.edu.cn/NewsDetail.aspx?ID=1219,suzhou_djg_site_crawl_2026-05-15\articles\1219_关于开展首批苏州市中小学师生信息素养提升实验基地申报与认定的通知.md
1220,馆长信箱,关于电教馆,TypeID 30、TypeID 31、TypeID 34、TypeID 35、TypeID 47、专题报道、中心机房、信息技能培训、公告通知、图文报道、工会之家、网络活动、网络通告、退教协活动,36,0,1,https://szdjg.suzhou.edu.cn/NewsDetail.aspx?ID=1220,suzhou_djg_site_crawl_2026-05-15\articles\1220_馆长信箱.md
1221,关于公布首批苏州市中小学师生信息素养提升实验基地审核认定结果的通知,公告通知,公告通知,73,1,1,https://szdjg.suzhou.edu.cn/NewsDetail.aspx?ID=1221,suzhou_djg_site_crawl_2026-05-15\articles\1221_关于公布首批苏州市中小学师生信息素养提升实验基地审核认定结果的通知.md
1222,师德监督,关于电教馆,TypeID 30、TypeID 31、TypeID 34、TypeID 35、TypeID 47、专题报道、中心机房、信息技能培训、公告通知、图文报道、工会之家、网络活动、网络通告、退教协活动,61,0,1,https://szdjg.suzhou.edu.cn/NewsDetail.aspx?ID=1222,suzhou_djg_site_crawl_2026-05-15\articles\1222_师德监督.md
1223,关于举行2023年苏州市信息化教学优质课大赛直属幼儿园选拔赛的通知,公告通知,公告通知,73,1,1,https://szdjg.suzhou.edu.cn/NewsDetail.aspx?ID=1223,suzhou_djg_site_crawl_2026-05-15\articles\1223_关于举行2023年苏州市信息化教学优质课大赛直属幼儿园选拔赛的通知.md
1224,关于组织参加2023年“领航杯”江苏省中小学生信息素养提升实践活动全国项目现场赛的通知,公告通知,公告通知,93,1,1,https://szdjg.suzhou.edu.cn/NewsDetail.aspx?ID=1224,suzhou_djg_site_crawl_2026-05-15\articles\1224_关于组织参加2023年“领航杯”江苏省中小学生信息素养提升实践活动全国项目现场赛的通知.md
1225,苏州市电化教育馆关于教育城域网病毒防护服务项目的采购公告,公告通知,公告通知,1360,0,1,https://szdjg.suzhou.edu.cn/NewsDetail.aspx?ID=1225,suzhou_djg_site_crawl_2026-05-15\articles\1225_苏州市电化教育馆关于教育城域网病毒防护服务项目的采购公告.md
1227,苏州市第七届青少年网络信息安全应用能力竞赛成绩揭晓,公告通知,公告通知,57,1,1,https://szdjg.suzhou.edu.cn/NewsDetail.aspx?ID=1227,suzhou_djg_site_crawl_2026-05-15\articles\1227_苏州市第七届青少年网络信息安全应用能力竞赛成绩揭晓.md
1228,2023年苏州市中小学生信息素养提升实践活动成绩揭晓,公告通知,公告通知,59,1,1,https://szdjg.suzhou.edu.cn/NewsDetail.aspx?ID=1228,suzhou_djg_site_crawl_2026-05-15\articles\1228_2023年苏州市中小学生信息素养提升实践活动成绩揭晓.md
1229,关于举办 2023 年苏州智慧教育示范区首席数据官培养工程的通知,公告通知,公告通知,32,0,1,https://szdjg.suzhou.edu.cn/NewsDetail.aspx?ID=1229,suzhou_djg_site_crawl_2026-05-15\articles\1229_关于举办 2023 年苏州智慧教育示范区首席数据官培养工程的通知.md
1230,关于公布2023年苏州市幼儿园组信息化教学优质课大赛细则的通知,公告通知,公告通知,69,1,1,https://szdjg.suzhou.edu.cn/NewsDetail.aspx?ID=1230,suzhou_djg_site_crawl_2026-05-15\articles\1230_关于公布2023年苏州市幼儿园组信息化教学优质课大赛细则的通知.md
1231,关于教育城域网病毒防护服务项目的成交公告,公告通知,公告通知,710,0,1,https://szdjg.suzhou.edu.cn/NewsDetail.aspx?ID=1231,suzhou_djg_site_crawl_2026-05-15\articles\1231_关于教育城域网病毒防护服务项目的成交公告.md
1233,关于苏州市教育系统网络安全监测通报预警服务项目的采购公告,公告通知,公告通知,1223,0,1,https://szdjg.suzhou.edu.cn/NewsDetail.aspx?ID=1233,suzhou_djg_site_crawl_2026-05-15\articles\1233_关于苏州市教育系统网络安全监测通报预警服务项目的采购公告.md
1234,关于苏州市教育系统网络安全监测通报预警服务项目的成交公告,公告通知,公告通知,594,0,1,https://szdjg.suzhou.edu.cn/NewsDetail.aspx?ID=1234,suzhou_djg_site_crawl_2026-05-15\articles\1234_关于苏州市教育系统网络安全监测通报预警服务项目的成交公告.md
1236,关于教育E卡通运维信息化监理服务及线上教育服务信息化监理服务项目,公告通知,公告通知,1336,0,1,https://szdjg.suzhou.edu.cn/NewsDetail.aspx?ID=1236,suzhou_djg_site_crawl_2026-05-15\articles\1236_关于教育E卡通运维信息化监理服务及线上教育服务信息化监理服务项目.md
1237,关于苏州教育视频会议系统运维服务的采购公告,公告通知,公告通知,1102,0,1,https://szdjg.suzhou.edu.cn/NewsDetail.aspx?ID=1237,suzhou_djg_site_crawl_2026-05-15\articles\1237_关于苏州教育视频会议系统运维服务的采购公告.md
1238,关于E卡通运维信息化监理服务及线上教育服务信息化监理服务的成交公告,公告通知,公告通知,780,0,1,https://szdjg.suzhou.edu.cn/NewsDetail.aspx?ID=1238,suzhou_djg_site_crawl_2026-05-15\articles\1238_关于E卡通运维信息化监理服务及线上教育服务信息化监理服务的成交公告.md
1239,关于苏州教育视频会议系统运维服务的成交公告,公告通知,公告通知,536,0,1,https://szdjg.suzhou.edu.cn/NewsDetail.aspx?ID=1239,suzhou_djg_site_crawl_2026-05-15\articles\1239_关于苏州教育视频会议系统运维服务的成交公告.md
1240,关于2023年度苏州市电化教育馆信息系统等级保护评测服务项目的采购公告,公告通知,公告通知,1436,0,1,https://szdjg.suzhou.edu.cn/NewsDetail.aspx?ID=1240,suzhou_djg_site_crawl_2026-05-15\articles\1240_关于2023年度苏州市电化教育馆信息系统等级保护评测服务项目的采购公告.md
1241,关于2023年度苏州市电化教育馆信息系统等级保护评测服务项目的成交公告,公告通知,公告通知,965,0,1,https://szdjg.suzhou.edu.cn/NewsDetail.aspx?ID=1241,suzhou_djg_site_crawl_2026-05-15\articles\1241_关于2023年度苏州市电化教育馆信息系统等级保护评测服务项目的成交公告.md
1242,关于苏州市电化教育馆2022年度单位决算公开的公告,公告通知,公告通知,49,1,1,https://szdjg.suzhou.edu.cn/NewsDetail.aspx?ID=1242,suzhou_djg_site_crawl_2026-05-15\articles\1242_关于苏州市电化教育馆2022年度单位决算公开的公告.md
1243,关于苏州市教师考核、评定、交流系统综合服务的采购公告,公告通知,公告通知,1372,0,1,https://szdjg.suzhou.edu.cn/NewsDetail.aspx?ID=1243,suzhou_djg_site_crawl_2026-05-15\articles\1243_关于苏州市教师考核、评定、交流系统综合服务的采购公告.md
1244,关于苏州市教师考核、评定、交流系统综合服务的成交公告,公告通知,公告通知,661,0,1,https://szdjg.suzhou.edu.cn/NewsDetail.aspx?ID=1244,suzhou_djg_site_crawl_2026-05-15\articles\1244_关于苏州市教师考核、评定、交流系统综合服务的成交公告.md
1245,苏州市教育E卡通改造接入“苏服办”移动端项目,公告通知,公告通知,1762,0,1,https://szdjg.suzhou.edu.cn/NewsDetail.aspx?ID=1245,suzhou_djg_site_crawl_2026-05-15\articles\1245_苏州市教育E卡通改造接入“苏服办”移动端项目.md
1246,苏州市电化教育馆关于线上教育中心综合服务项目跟踪管理的采购公告,公告通知,公告通知,1255,0,1,https://szdjg.suzhou.edu.cn/NewsDetail.aspx?ID=1246,suzhou_djg_site_crawl_2026-05-15\articles\1246_苏州市电化教育馆关于线上教育中心综合服务项目跟踪管理的采购公告.md
1247,关于苏州市教育E卡通改造接入“苏服办”移动端项目的成交公告,公告通知,公告通知,771,0,1,https://szdjg.suzhou.edu.cn/NewsDetail.aspx?ID=1247,suzhou_djg_site_crawl_2026-05-15\articles\1247_关于苏州市教育E卡通改造接入“苏服办”移动端项目的成交公告.md
1248,关于线上教育中心综合服务项目跟踪管理的成交公告,公告通知,公告通知,566,0,1,https://szdjg.suzhou.edu.cn/NewsDetail.aspx?ID=1248,suzhou_djg_site_crawl_2026-05-15\articles\1248_关于线上教育中心综合服务项目跟踪管理的成交公告.md
1249,关于“教育工作年度专题片”服务项目的竞争性谈判采购公告,公告通知,公告通知,1147,0,1,https://szdjg.suzhou.edu.cn/NewsDetail.aspx?ID=1249,suzhou_djg_site_crawl_2026-05-15\articles\1249_关于“教育工作年度专题片”服务项目的竞争性谈判采购公告.md
1250,关于“教育工作年度专题片”服务项目的成交公告,公告通知,公告通知,588,0,1,https://szdjg.suzhou.edu.cn/NewsDetail.aspx?ID=1250,suzhou_djg_site_crawl_2026-05-15\articles\1250_关于“教育工作年度专题片”服务项目的成交公告.md
1251,关于2024年度教职工工作餐供应的竞争性谈判采购公告,公告通知,公告通知,1565,0,1,https://szdjg.suzhou.edu.cn/NewsDetail.aspx?ID=1251,suzhou_djg_site_crawl_2026-05-15\articles\1251_关于2024年度教职工工作餐供应的竞争性谈判采购公告.md
1252,关于2024年度保洁服务项目的采购公告,公告通知,公告通知,1303,0,1,https://szdjg.suzhou.edu.cn/NewsDetail.aspx?ID=1252,suzhou_djg_site_crawl_2026-05-15\articles\1252_关于2024年度保洁服务项目的采购公告.md
1253,关于2024年度教职工工作餐供应项目的成交公告,公告通知,公告通知,576,0,1,https://szdjg.suzhou.edu.cn/NewsDetail.aspx?ID=1253,suzhou_djg_site_crawl_2026-05-15\articles\1253_关于2024年度教职工工作餐供应项目的成交公告.md
1254,关于苏州教育改革和发展战略性与政策性课题研究项目的竞争性谈判采购公告,公告通知,公告通知,1647,0,1,https://szdjg.suzhou.edu.cn/NewsDetail.aspx?ID=1254,suzhou_djg_site_crawl_2026-05-15\articles\1254_关于苏州教育改革和发展战略性与政策性课题研究项目的竞争性谈判采购公告.md
1255,关于2024年度保洁服务项目的竞争性磋商成交公告,公告通知,公告通知,618,0,1,https://szdjg.suzhou.edu.cn/NewsDetail.aspx?ID=1255,suzhou_djg_site_crawl_2026-05-15\articles\1255_关于2024年度保洁服务项目的竞争性磋商成交公告.md
1256,关于教育局大数据展示看板运维服务项目的采购公告,公告通知,公告通知,1250,0,1,https://szdjg.suzhou.edu.cn/NewsDetail.aspx?ID=1256,suzhou_djg_site_crawl_2026-05-15\articles\1256_关于教育局大数据展示看板运维服务项目的采购公告.md
1257,关于苏州教育改革和发展战略性与政策性课题研究项目的废标公告,公告通知,公告通知,367,0,1,https://szdjg.suzhou.edu.cn/NewsDetail.aspx?ID=1257,suzhou_djg_site_crawl_2026-05-15\articles\1257_关于苏州教育改革和发展战略性与政策性课题研究项目的废标公告.md
1259,关于苏州教育改革和发展战略性与政策性课题研究项目的竞争性谈判采购公告,公告通知,公告通知,1678,0,1,https://szdjg.suzhou.edu.cn/NewsDetail.aspx?ID=1259,suzhou_djg_site_crawl_2026-05-15\articles\1259_关于苏州教育改革和发展战略性与政策性课题研究项目的竞争性谈判采购公告.md
1260,关于教育局大数据展示看板运维服务的成交公告,公告通知,公告通知,634,0,1,https://szdjg.suzhou.edu.cn/NewsDetail.aspx?ID=1260,suzhou_djg_site_crawl_2026-05-15\articles\1260_关于教育局大数据展示看板运维服务的成交公告.md
1261,关于苏州教育改革和发展战略性与政策性课题研究项目的成交公告,公告通知,公告通知,1196,0,1,https://szdjg.suzhou.edu.cn/NewsDetail.aspx?ID=1261,suzhou_djg_site_crawl_2026-05-15\articles\1261_关于苏州教育改革和发展战略性与政策性课题研究项目的成交公告.md
1262,公示-2023年苏州市智慧校园发展水平四星级学校拟认定名单,公告通知,公告通知,1925,1,1,https://szdjg.suzhou.edu.cn/NewsDetail.aspx?ID=1262,suzhou_djg_site_crawl_2026-05-15\articles\1262_公示-2023年苏州市智慧校园发展水平四星级学校拟认定名单.md
1264,关于2024年江苏省系列教育信息化应用能力大赛市级选拔赛和苏州市智慧校园发展水平星级评估与人工智能教育实验学校评审项目的竞争性谈判采购公告,公告通知,公告通知,1506,0,1,https://szdjg.suzhou.edu.cn/NewsDetail.aspx?ID=1264,suzhou_djg_site_crawl_2026-05-15\articles\1264_关于2024年江苏省系列教育信息化应用能力大赛市级选拔赛和苏州市智慧校园发展水平星级评估与人工智能教育实验学校评审项目的竞争性谈判采购公告.md
1265,苏州市电化教育馆2024年度单位预算公开,公告通知,公告通知,24,1,1,https://szdjg.suzhou.edu.cn/NewsDetail.aspx?ID=1265,suzhou_djg_site_crawl_2026-05-15\articles\1265_苏州市电化教育馆2024年度单位预算公开.md
1266,关于2024年江苏省系列教育信息化应用能力大赛市级选拔赛和苏州市智慧校园发展水平星级评估与人工智能教育实验学校评审项目的成交公告,公告通知,公告通知,689,0,1,https://szdjg.suzhou.edu.cn/NewsDetail.aspx?ID=1266,suzhou_djg_site_crawl_2026-05-15\articles\1266_关于2024年江苏省系列教育信息化应用能力大赛市级选拔赛和苏州市智慧校园发展水平星级评估与人工智能教育实验学校评审项目的成交公告.md
1267,关于苏州电教馆中心机房及城域网日常运维服务项目的采购公告,公告通知,公告通知,1279,0,1,https://szdjg.suzhou.edu.cn/NewsDetail.aspx?ID=1267,suzhou_djg_site_crawl_2026-05-15\articles\1267_关于苏州电教馆中心机房及城域网日常运维服务项目的采购公告.md
1268,苏州市电化教育馆2024年度部门整体支出绩效目标,公告通知,公告通知,19,1,1,https://szdjg.suzhou.edu.cn/NewsDetail.aspx?ID=1268,suzhou_djg_site_crawl_2026-05-15\articles\1268_苏州市电化教育馆2024年度部门整体支出绩效目标.md
1269,苏州市电化教育馆2024年度项目支出绩效目标,公告通知,公告通知,14,1,1,https://szdjg.suzhou.edu.cn/NewsDetail.aspx?ID=1269,suzhou_djg_site_crawl_2026-05-15\articles\1269_苏州市电化教育馆2024年度项目支出绩效目标.md
1270,关于中心机房及城域网日常运维服务的成交公告,公告通知,公告通知,662,0,1,https://szdjg.suzhou.edu.cn/NewsDetail.aspx?ID=1270,suzhou_djg_site_crawl_2026-05-15\articles\1270_关于中心机房及城域网日常运维服务的成交公告.md
1271,关于教育城域网病毒防护服务项目采购的公告,公告通知,公告通知,2141,0,1,https://szdjg.suzhou.edu.cn/NewsDetail.aspx?ID=1271,suzhou_djg_site_crawl_2026-05-15\articles\1271_关于教育城域网病毒防护服务项目采购的公告.md
1272,关于教育城域网病毒防护服务项目的成交公告,公告通知,公告通知,771,0,1,https://szdjg.suzhou.edu.cn/NewsDetail.aspx?ID=1272,suzhou_djg_site_crawl_2026-05-15\articles\1272_关于教育城域网病毒防护服务项目的成交公告.md
1273,关于2024年房屋筑漏及零星维修项目的采购公告,公告通知,公告通知,1327,0,1,https://szdjg.suzhou.edu.cn/NewsDetail.aspx?ID=1273,suzhou_djg_site_crawl_2026-05-15\articles\1273_关于2024年房屋筑漏及零星维修项目的采购公告.md
1274,关于2024年房屋筑漏及零星维修项目的竞争性谈判成交公告,公告通知,公告通知,629,0,1,https://szdjg.suzhou.edu.cn/NewsDetail.aspx?ID=1274,suzhou_djg_site_crawl_2026-05-15\articles\1274_关于2024年房屋筑漏及零星维修项目的竞争性谈判成交公告.md
1275,关于苏州市教育E卡通管理平台维护服务的竞争性谈判采购公告,公告通知,公告通知,1183,0,1,https://szdjg.suzhou.edu.cn/NewsDetail.aspx?ID=1275,suzhou_djg_site_crawl_2026-05-15\articles\1275_关于苏州市教育E卡通管理平台维护服务的竞争性谈判采购公告.md
1276,关于苏州市教育E卡通管理平台维护服务的成交公告,公告通知,公告通知,589,0,1,https://szdjg.suzhou.edu.cn/NewsDetail.aspx?ID=1276,suzhou_djg_site_crawl_2026-05-15\articles\1276_关于苏州市教育E卡通管理平台维护服务的成交公告.md
1277,关于教育E卡通运维服务信息化监理服务及线上教育中心综合服务信息化监理服务项目的竞争性谈判采购公告,公告通知,公告通知,1646,0,1,https://szdjg.suzhou.edu.cn/NewsDetail.aspx?ID=1277,suzhou_djg_site_crawl_2026-05-15\articles\1277_关于教育E卡通运维服务信息化监理服务及线上教育中心综合服务信息化监理服务项目的竞争性谈判采购公告.md
1278,关于教育E卡通运维服务信息化监理服务及线上教育中心综合服务信息化监理服务项目的成交公告,公告通知,公告通知,791,0,1,https://szdjg.suzhou.edu.cn/NewsDetail.aspx?ID=1278,suzhou_djg_site_crawl_2026-05-15\articles\1278_关于教育E卡通运维服务信息化监理服务及线上教育中心综合服务信息化监理服务项目的成交公告.md
1279,关于教育工作宣传服务项目的招标公告,公告通知,公告通知,1531,0,1,https://szdjg.suzhou.edu.cn/NewsDetail.aspx?ID=1279,suzhou_djg_site_crawl_2026-05-15\articles\1279_关于教育工作宣传服务项目的招标公告.md
1280,关于苏州教育视频会议运维服务项目的采购公告,公告通知,公告通知,1136,0,1,https://szdjg.suzhou.edu.cn/NewsDetail.aspx?ID=1280,suzhou_djg_site_crawl_2026-05-15\articles\1280_关于苏州教育视频会议运维服务项目的采购公告.md
1281,关于教育工作宣传服务项目的成交公告,公告通知,公告通知,543,0,1,https://szdjg.suzhou.edu.cn/NewsDetail.aspx?ID=1281,suzhou_djg_site_crawl_2026-05-15\articles\1281_关于教育工作宣传服务项目的成交公告.md
1282,关于苏州教育视频会议运维服务项目的成交公告,公告通知,公告通知,482,0,1,https://szdjg.suzhou.edu.cn/NewsDetail.aspx?ID=1282,suzhou_djg_site_crawl_2026-05-15\articles\1282_关于苏州教育视频会议运维服务项目的成交公告.md
